,video_id,channelTitle,title,tags,publishedAt,viewCount,likeCount,commentCount,subscriberCount,duration,definition,thumbnail-url
360,AG69nZPVJ7s,Animal Planet Latinoamérica,¿Hay problemas con el embarazo de esta rinoceronte? | Los Irwin | Animal Planet,"['ifpal', 'animal planet en español', 'animal planet latinoamérica', 'como puedo ver animal planet en español', 'documentales animales', 'programa de la familia de steve irwin', 'programas de animal planet doblados en español', 'untitled irwin family project ver en español', 'ver animal planet en español', 'ver animal planet en español online gratis', 'ver video de los irwin en animal planet', 'rinoceronte Caballé', 'rinoceronte hembra', 'embarazo rinoceronte', 'rinoceronte irwin', 'embarazo rinoceronte irwin']",2019-07-19T21:00:00Z,1589023,21728,230,,PT7M17S,hd,https://i.ytimg.com/vi/AG69nZPVJ7s/hqdefault.jpg
361,sAM3PoFvubE,Bayerischer Rundfunk,"Ein Zicklein wird geboren: Ziegenhof und Käserei ""Peters Glück"" | Landwirtschaft | Reportage | BR","['direktvermarktung ziegenmilch', 'lammzeit zicklein', 'lammzeit ziegen', 'marktbergel ziegen', 'markus hütter', 'mira hütter', 'peters glück ziegen', 'tiere', 'ziegen lammzeit', 'ziegenhaltung', 'ziegenhof peters glück', 'ziegenkäse ziegen', 'ziegenlämmer', 'ziegenzüchter', 'ziegenmilch', 'ziegenkäse', 'ziegenkäse direktvermarktung', 'ziegenkäse peters glück', 'zicklein lammzeit', 'peters glück ziegenmilch', 'käse', 'herde', 'landwirtschaft', 'viehwirtschaft', 'fütterung', 'melkziegen', 'geburt', 'tierhaltung', 'edelziege', 'stall', 'lammzeit', 'lämmer']",2023-03-18T07:01:52Z,59676,498,28,,PT14M17S,hd,https://i.ytimg.com/vi/sAM3PoFvubE/hqdefault.jpg
362,F2TEj7RTXXM,National Geographic Wild France,Un anaconda dévore un imposant repas,"['Natgeo', 'national geographic', 'documentaire', 'nat geo wild', 'national geographic wild', 'national geographic france', 'nat geo france', 'nat geo animaux', 'national geographique', 'national geographique animaux', 'nationale geographique', 'anaconda', 'serpent']",2021-02-03T18:15:01Z,609313,4674,222,,PT4M15S,hd,https://i.ytimg.com/vi/F2TEj7RTXXM/hqdefault.jpg
363,09XtEcpxRBQ,Animal Planet Latinoamérica,¡Manta raya golpea la cara de Robert Irwin! | Los Irwin | Animal Planet,"['ifpal', 'documentales animales', 'programa de la familia de steve irwin', 'programas de animal planet doblados en español', 'untitled irwin family project ver en español', 'ver animal planet en español', 'ver animal planet en español online gratis', 'ver video de los irwin en animal planet', 'manta raya golpea la cara de robert irwin', 'robert irwin nada con manta rayas', 'robert irwin toma fotos de manta rayas', 'robert irwin en la costa de coral', 'curiosidades de manta rayas', 'manta ra curiosidades']",2019-08-02T21:00:00Z,1289720,19793,695,,PT8M6S,hd,https://i.ytimg.com/vi/09XtEcpxRBQ/hqdefault.jpg
364,6BHX443TXko,Unser Land,Futter der Zukunft: Maden der Soldatenfliege als Insektenprotein im Futtertrog | Unser Land | BR,"['br fernsehen unser land', 'futter', 'futter der zukunft', 'futtertrog', 'geflügel', 'getrocknete larven', 'hermetia illucens', 'insekten', 'insektenlarven', 'insektenprotein', 'insektenzucht', 'landwirte', 'landwirtschaft', 'larven', 'maden', 'maden tierfutter', 'maden verfüttern', 'nutztiere', 'nutztiere füttern', 'schwarze soldatenfliege', 'schweine', 'soja', 'soldatenfliege', 'soldatenfliege züchten', 'soldatenfliegenlarven', 'tiere füttern', 'tierfutter aus insekten', 'unser land 2023', 'unser land br', 'unser land youtube', 'insekten essen']",2023-01-22T16:00:02Z,83365,687,179,,PT6M35S,hd,https://i.ytimg.com/vi/6BHX443TXko/hqdefault.jpg
365,8k0MxRirlvw,GeoBeats Animals,Man learns his adopted dog is someone else's. His response is perfect.,,2024-12-19T23:08:59Z,340134,16029,1597,,PT2M51S,hd,https://i.ytimg.com/vi/8k0MxRirlvw/hqdefault.jpg
366,i-Yi13jBkYk,Truestory,so cool#agt,,2024-12-21T00:22:04Z,833009,42171,118,,PT59S,hd,https://i.ytimg.com/vi/i-Yi13jBkYk/hqdefault.jpg
367,I06mVPDypzA,Real Wild Deutschland,Raubtiere: die geborenen Jäger hautnah!  | Wildes Überleben | Real Wild Deutschland,"['geborene jäger', 'wildes überleben', 'real wild deutschland', 'real wild', 'doku', 'tier doku', 'natur doku', 'dokumentation', 'löwenjagd', 'löwenjagd in afrika', 'löwenjagd in afrika angriff', 'löwenjagd doku', 'löwenjagd in afrika videos', 'wildkatzen dokumentation', 'natur doku arte', 'tier doku schlange', 'tier doku deutsch pinguine', 'wildes überleben 3sat', 'wildnis doku', 'raubtier doku', 'großkatzen doku', 'raubtiere geborenen jäger', 'gefährliche tiere doku', 'katzen auf der jagd', 'tier auf der jagd']",2022-02-17T17:00:18Z,70061,500,14,,PT43M23S,hd,https://i.ytimg.com/vi/I06mVPDypzA/hqdefault.jpg
368,Niij51tS5Y4,Fressnapf,Liebenswerte Freunde und Helfer im Alltag: VITA Assistenzhunde,"['Assistenzhunde', 'VITA Assistenzhunde', 'VITA', 'Fressnapf', 'Spende', 'Fressnapf Spende', 'Helfer im Alltag', 'Blindenhunde', 'Hunde für Menschen mit Behinderung', 'Assistance Dog', 'Golden Retriever', 'Labrador Retriever (Animal Breed)', 'Kinder mit Behinderung', 'Tierischer Helfer', 'Helfer auf vier Pfoten', 'Freundschaft', 'Aus Fremden werden Freunde', 'Fressnapf CSR']",2015-01-19T07:46:05Z,20527,248,14,,PT6M34S,hd,https://i.ytimg.com/vi/Niij51tS5Y4/hqdefault.jpg
369,XX0SK-yVja4,日本平動物園,日本平動物園ホッキョクグマ（ロッシー・バニラ）ライブカメラ,"['日本平動物園', 'ホッキョクグマ', 'ロッシー', 'バニラ', 'ライブカメラ', 'しろくま', 'くるくる']",2019-02-01T02:41:02Z,743590,2789,0,,P0D,sd,https://i.ytimg.com/vi/XX0SK-yVja4/hqdefault_live.jpg
370,4Vc2RWl5VEI,Wolliges.Bewildert,Nicht befruchtete Bruteier verwenden?! Wofür?!,"['bewildert', 'wolliges.bewildert', 'Hühner', 'Bielefelder', 'Bielefelder Zwergkennhuhn', 'Bielefelder Zwerge', 'Sulmtaler', 'Sulmtaler Zwerge', 'Zwerghühner', 'Zwerghuhn', 'Kennhuhn', 'Zwerge', 'Huhn', 'Küken', 'Henne', 'Hahn', 'Futter', 'Fressen', 'natürlich', 'Freiland', 'Bio', 'biologisch', 'Garten', 'Hühner im Garten', 'eigener Garten', 'Auslauf', 'Stall', 'Barnevelder', 'Glucke', 'schwarz', 'braun', 'doppelt', 'gesäumt', 'Kennhühner', 'Junghuhn', 'Junghenne', 'Junghahn', 'Mischling', 'Mischlingshuhn', 'Mischlingshenne', 'Bruteier', 'nicht', 'befruchtet', 'was', 'wohin', 'weg', 'verwerten', 'verwenden', 'essen', 'kochen', 'futter']",2023-02-10T13:00:05Z,195510,10540,147,,PT1M,hd,https://i.ytimg.com/vi/4Vc2RWl5VEI/hqdefault.jpg
371,JKT7lhOcSbo,Pilsali,Wir haben heute unseren Welpen kennengelernt 😍🐾 #flatcoatedretriever,,2023-06-10T19:12:56Z,395769,19233,219,,PT37S,hd,https://i.ytimg.com/vi/JKT7lhOcSbo/hqdefault.jpg
372,lwklc4aY7ds,Nature on PBS,Lion Cubs Playing with Mom and Dad,"['Lion', 'Lions', 'cubs', 'cub', 'baby animals', 'animal families', 'animals', 'animal', 'nature documentary', 'documentaries', 'cats', 'big cats', 'summer', 'love', 'summer of love', 'pbs', 'public television', 'television', 'film', 'nature', 'natural', 'natural world', 'live nature', 'episode preview', 'watering hole', 'habitats', 'pride']",2016-04-12T15:04:02Z,184746,2155,75,,PT2M28S,hd,https://i.ytimg.com/vi/lwklc4aY7ds/hqdefault.jpg
373,0SwSldN_6M4,Ellie Golden Life,Dog picks favorite bbq food! #goldenretriever #dog,,2022-07-02T13:18:40Z,34002650,1889422,6240,,PT42S,hd,https://i.ytimg.com/vi/0SwSldN_6M4/hqdefault.jpg
374,suZ44RFUXNQ,Pets & Vets,Calgary Rescue Dogs Save Trapped Toddler's Life Twice! | Pet Heroes,"['Amazing Creatures', 'Animal Lovers', 'Blue Ant International', 'Dedicated Animals', 'Dog Training', 'Dramatic Re-enactments', 'Heroic Acts', 'Inspiring Pets', 'Lifesaving Adventures.', 'Little Dot Studios', 'Loyal Guardians', 'Police Canines', 'Protective Pets', 'Rescue Operations', 'Search & Rescue Dogs', 'Touching Tales', 'Unbreakable Bonds']",2021-08-31T21:03:05Z,26069,780,12,,PT21M8S,hd,https://i.ytimg.com/vi/suZ44RFUXNQ/hqdefault.jpg
375,zZukAo-KTHc,Animal Planet Latinoamérica,Frank interactúa sin miedo con felinos salvajes | Wild Frank | Animal Planet,"['animal planet', 'animal planet en español', 'animal planet latinoamérica', 'como puedo ver animal planet en español', 'documentales animales', 'ver animal planet en español', 'ver animal planet en español latino', 'vida salvaje', 'historia natural', 'Frank Cuesta', 'wild frank', 'wild frank en español', 'wild frank latinoamerica', 'american planet latinoamerica', 'Compilacion wild frank', 'wild frank animal planet', 'wild frank áfrica', 'felinos wild frank', 'felinos frank cuesta', 'Wild Frank tigre']",2021-01-08T20:21:04Z,1895195,31699,992,,PT9M11S,hd,https://i.ytimg.com/vi/zZukAo-KTHc/hqdefault.jpg
376,mUm7b5_UGZ0,Nature on PBS,The Sneaky Mating Strategy of Red Kangaroos,"['nature', 'natural world', 'live nature', 'natural', 'kangaroos', 'kangaroo', 'joey', 'dominance', 'mating', 'breeding', 'reproduction', 'animals', 'animal', 'wild animals', 'pbs', 'public television', 'television', 'film', 'episode preview', 'sneaky', 'alpha']",2016-01-25T20:17:09Z,4216102,13328,840,,PT2M30S,hd,https://i.ytimg.com/vi/mUm7b5_UGZ0/hqdefault.jpg
377,cSQXLWi9SlI,Tobi Langer,Welpe zieht ein: ZELDA die Wuffzessin #hund #short #wuffzessin #welpe #hundeliebe,"['hunde erziehen', 'welpe', 'hund', 'wuffzessin', 'wuffinator', 'dog', 'hund erziehen anfänger', 'dog videos', 'hunde erziehen martin rütter']",2023-04-11T19:25:58Z,1353338,93618,358,,PT45S,hd,https://i.ytimg.com/vi/cSQXLWi9SlI/hqdefault.jpg
378,NAVHmwWej90,Techy Pool,Cute little puppies barking,"['???', 'Dog', '(Domesticated', 'Animal)', 'puppy']",2015-05-29T15:46:25Z,64,5,0,,PT56S,hd,https://i.ytimg.com/vi/NAVHmwWej90/hqdefault.jpg
379,uAIZrRAR31Y,BBC Earth,Slow Motion Pigeon Flight | BBC Earth,"['bbc documentary', 'bbc', 'bbcearth', 'bbc earth', 'Secrets of Bones', 'Bones Documentary', 'Science of Bones', 'Bones', 'Skeleton documentary', 'chemistry with bones', 'animal skeleton', 'experiment with bones', 'pigeon documentary', 'slow motion pigeon', 'bones of a pigeon', 'pigeon skeleton', 'trained pigeon', 'How pigeons fly', 'Bird', 'Birds']",2019-08-13T16:00:10Z,177002,3676,200,,PT2M46S,hd,https://i.ytimg.com/vi/uAIZrRAR31Y/hqdefault.jpg
380,hmasHE4g2wc,Chewy,How to Prevent and Treat Puppy Separation Anxiety | Chewtorials,"['Puppy separation anxiety', 'dog separation anxiety', 'separation anxiety training', 'separation anxiety', 'seperation anxiety', 'dog training tips', 'leaving dog at home alone', 'dog anxiety', 'chewtorials', 'chewy', 'chewy.com']",2021-07-29T15:00:17Z,461433,2105,150,,PT2M54S,hd,https://i.ytimg.com/vi/hmasHE4g2wc/hqdefault.jpg
381,1jJLu9kslQk,River Monsters™,Catfish Attack In Berlin | HORROR STORY | River Monsters,"['river monsters', 'discovery channel', 'fishing', 'crocodile', 'anaconda', 'piranha', 'eel', 'dark waters', 'mighty rivers', 'alligator', 'catfish', 'tiger fish', 'shark', 'arapaima', 'amazon', 'brazil', 'jeremy wade', 'river monsters jeremy wade', 'catch', 'compilation', 'bite', 'blood', 'attack', 'river monsters piranha', 'animal planet', 'extreme fishing', 'river monsters chlidren', 'river monsters horror story', 'wels catfish']",2017-04-11T15:00:00Z,45164,502,47,,PT3M9S,hd,https://i.ytimg.com/vi/1jJLu9kslQk/hqdefault.jpg
382,i6-OZ5oHYT0,Nature Bites,David Attenborough's Miracle Plant Took 200 Years To Grow | Nature Bites,"['Nature Bites', 'avid attenborough documentary', 'david attenborough', 'david attenborough cop26', 'david attenborough cop26 speech', 'david attenborough kew gardens', 'david attenborough killer plant', 'david attenborough kingdom', 'david attenborough kingdom of plants', 'david attenborough kingdom of plants episode 1', 'david attenborough kingdom of plants watch online', 'david attenborough miracle plant', 'david attenborough plant']",2021-11-12T17:30:05Z,3874850,53860,2739,,PT7M45S,hd,https://i.ytimg.com/vi/i6-OZ5oHYT0/hqdefault.jpg
383,vKgqJgomwqM,Chewy,How To Teach a Dog To Come When Called | Chewtorials,"['chewy', 'chewy.com', 'How to teach a dog to come', 'teach a dog to come', 'train a dog to come', 'training a dog to come when called', 'train a puppy to come when called', 'puppy come', 'chewtorials']",2022-01-18T16:00:28Z,264089,1614,313,,PT2M4S,hd,https://i.ytimg.com/vi/vKgqJgomwqM/hqdefault.jpg
384,KSG4cFysbGU,BBC Earth,Flying Spiders! | Animal Einsteins | BBC Earth,"['bbc documentary', 'bbc', 'bbcearth', 'bbc earth', 'spider', 'flying spider', 'static electricity', 'university of bristol', 'chris packham', 'nature', 'amazing biology']",2021-03-24T14:00:13Z,317095,6056,506,,PT3M7S,hd,https://i.ytimg.com/vi/KSG4cFysbGU/hqdefault.jpg
385,zt3AVydlc2g,Zak George’s Dog Training Revolution,NEW PUPPY SURVIVAL GUIDE: The First 24 Hours! (NEW SERIES! EPISODE 1),"['new puppy', 'puppy training', 'doodle puppy', 'puppy survival guide', 'puppy series', 'dog training', 'puppy issues', 'puppy socialization', 'puppy introduction', 'dog to dog play', 'leash pulling', 'potty training', 'barking', 'jumping', 'destructive chewing', 'puppy tips', 'positive reinforcement', 'force free', 'humane puppy training', 'positive dog trainer', 'zak george', 'irish doodle', 'goldendoodle', 'R+', 'cute puppy', 'how to train your dog', 'easy dog training', 'effective dog training', 'fast puppy training']",2020-10-25T16:00:11Z,3682919,38655,1856,,PT50M9S,hd,https://i.ytimg.com/vi/zt3AVydlc2g/hqdefault.jpg
386,yLEP9TkiWp0,"Elefant, Tiger & Co.","Bullen*innen - Kühe*außen (Folge 1018) | Elefant, Tiger & Co. | MDR","['Tiger & Co', 'ETC', 'Zoo Leipzig', 'Zoosendung', 'elefant tiger und co', 'giraffe erdmännchen und co', 'panda gorilla und co', 'tiger elefant und co', 'elefanttigerundco', 'elephant tiger und co', 'zoo leipzig zoosendung', 'zoosendung mdr', 'zoosendung ard', 'zooserie und co', 'elefant und co', 'et&c', 'zoo park leipzig', 'zoo leipzig mdr', 'zoosendung neue folgen', 'zoosendung ganze folgen', 'Doku Soap', 'mdr fernsehen', 'zoologischer garten leipzig', 'etc 1018', 'Elefantenfamilie Zoo Leipzig', 'Fütterung von Komodowaran']",2023-03-11T08:15:02Z,59223,831,116,,PT24M29S,hd,https://i.ytimg.com/vi/yLEP9TkiWp0/hqdefault.jpg
387,qTsFtTb-jfY,Kumo,La Plus Grosse VICTIME de la Nature | Le Babiroussa 🐖 #shorts,"['babiroussa', 'babirusa', 'babiroussa mort', 'babirusa pig', 'cochon', 'defense', 'babiroussa fight', 'pig', 'asie', 'asia', 'pig asia', 'cochon asie', 'victime', 'chance', 'nature', 'drole', 'animal', 'animals', 'animaux', 'faune', 'dinguerie', 'incroyable', 'animal incroyable', 'animal drole', 'nature 4k', 'funny', 'cochons', 'sanglier', 'porc', 'kumo', 'koumo', 'documentaire']",2024-12-21T17:15:02Z,262218,14546,82,,PT1M,hd,https://i.ytimg.com/vi/qTsFtTb-jfY/hqdefault.jpg
388,nG3NSE7U3M8,Aquarium Info,I Built a Giant Ecosphere Bowl,"['planted tank', 'aquarium', 'fish tank', 'ecosystem aquarium', 'no filter aquarium', 'no filter tank', 'ecosystem tank', 'planted aquarium', 'aquascape', 'planted tank tutorial', 'bowl', 'aquarium bowl', 'aquascaping', 'bowl fish tank', 'fish', 'aquascape tutorial', 'aquarium tutorial', 'aquarium setup', 'bowl setup', 'aquarium how to', 'aquarium guide', 'fish tank setup', 'aquarium info kirby', 'fish tank bowl', 'no co2 planted tank', 'no co2 no filter planted tank', 'no water change aquarium']",2022-05-23T21:00:16Z,2531492,30613,1635,,PT3M20S,hd,https://i.ytimg.com/vi/nG3NSE7U3M8/hqdefault.jpg
389,KLz4bLYzZQc,Die Maus,Wie schlüpft das Küken aus dem Ei? | DieMaus | WDR,"['Tier', 'Tierdoku', 'Die Maus', 'Maus und Elefant', 'Die Sendung mit der Maus', 'Sendung mit der Maus', 'Sachgeschichte', 'Maus', 'WDR', 'Die Maus WDR', 'Armin', 'Küken', 'Hühner', 'Hühnerei', 'Luftblase', 'Frühstück', 'Eier']",2021-05-22T06:00:08Z,95343,517,0,,PT13M8S,hd,https://i.ytimg.com/vi/KLz4bLYzZQc/hqdefault.jpg
390,PD-66K8vSxo,GẤU BÉO,Chú chó già đau buồn vì sắp phải chia ly với người chủ,,2024-12-21T10:00:31Z,146203,6256,51,,PT2M46S,hd,https://i.ytimg.com/vi/PD-66K8vSxo/hqdefault.jpg
391,f3TmFtq1WZ8,Shambhavi Singh,ZOOMER ROBOTIC DOG honest review and Rating I Reviewing Zoomer dog,"['Zoomer', 'Zoomer Dog', 'Robotic Dog', 'Dog', 'Robot', 'Zoomer Robotic dog', 'Dog review', 'Robotic dog review', 'Rating', 'Zomer dog', 'Zoomer dog rating', 'Zoomer dog review', 'Robotic', 'Pet', 'Companion', 'Robotic pet', 'German toy', 'Zoomer Dog review', 'Zoomer review', 'Reveiwing Zoomer']",2018-09-23T15:23:07Z,221,19,,,PT2M38S,hd,https://i.ytimg.com/vi/f3TmFtq1WZ8/hqdefault.jpg
392,L-lk8CUgj-s,Westernwilson,Bait Hive June 04 2017,"['honey bee', 'honeybee', 'scout', 'scouts', 'swarming preparation', 'swarming', 'swarm']",2017-06-12T15:22:46Z,22,0,0,,PT30S,hd,https://i.ytimg.com/vi/L-lk8CUgj-s/hqdefault.jpg
393,74raKUtbCKI,Levi the Husky Rescue,my husky’s fren needs your help 🥺💕 UPDATE: we reached our goal! TYSM!,,2024-12-21T15:28:21Z,131947,,352,,PT55S,hd,https://i.ytimg.com/vi/74raKUtbCKI/hqdefault.jpg
394,h0go08icyTg,The Dodo,Random Cat Keeps Walking With Woman And Her Dogs | The Dodo,"['animal video', 'animals', 'the dodo', 'Animal Rescue', 'dodo', 'cute animals', 'pets', 'wildlife', 'pet videos', 'wildlife videos', 'animals the dodo', 'the dodo animals', 'rescuing animals']",2024-12-21T16:00:39Z,109841,17094,184,,PT59S,hd,https://i.ytimg.com/vi/h0go08icyTg/hqdefault.jpg
395,thML2Hai6mc,Great Big Story,The Very Raddest Reptiles And Amphibians,"['great big story', 'gbs', 'lag', 'great big reel', 'great big reek 118', 'reptiles', 'pine snake', 'endangered', 'beaded lizard', 'Guatemala', 'spider tortoise', 'Madagascar', 'alligator', 'China', 'viper', 'poisonous', 'salamander', 'conservation', 'golden frog', 'extinct', 'turtle', 'wetlands', 'frog', 'snake', 'Planet Earth']",2016-10-12T21:28:20Z,401411,7090,721,,PT9M57S,hd,https://i.ytimg.com/vi/thML2Hai6mc/hqdefault.jpg
396,nEobGKAlGEU,AntsCanada,Ants vs. Carnivorous Plants,"['ants', 'antscanada', 'mikey bustos', 'myrmecology', 'antfarm', 'ant colony', 'ant nest', 'queen ant', 'formicarium', 'antstore', 'ant habitat', 'antworks', 'insects', 'science', 'pets', 'exotic', 'carnivorous plants', 'pitcher plant', 'nepenthes', 'venus fly trap', 'yellow crazy ants', 'anoplolepis gracilipes', 'terrarium']",2017-06-17T12:00:04Z,5446849,108257,14206,,PT19M21S,hd,https://i.ytimg.com/vi/nEobGKAlGEU/hqdefault.jpg
397,J0Rt1XV-R3s,Simon's Cat Extra,An Excitable Cat 🐱 | Simon's Cat Extra | #shorts,"[""simon's cat"", 'simons cat', 'simons cats', ""simon's katze"", 'simon tofield', 'simon the cat', 'Simon', 'Tofield', 'simonscat', 'animated cats', 'animated animals', 'animal (film character)', 'black and white', 'black and white cat', 'cat lovers', 'cat fails', 'cute cats', 'funny cat', 'funny cats', 'kids', 'short animation', 'Animated', 'Animation', 'cartoon', 'cartoons', 'Cat', 'cats', 'cute', 'fun', 'Funny', 'Humour', 'kitten', 'kittens', 'kitty', 'pets', 'Toons', 'videos', 'youtube shorts', 'tv dinner', 'black and white animation', 'cat sofa', 'living room']",2022-12-29T10:00:08Z,2597051,92063,94,,PT1M,hd,https://i.ytimg.com/vi/J0Rt1XV-R3s/hqdefault.jpg
398,fV7kuUrjutY,JSHorsemanship,HOW TO RIDE A HORSE FOR BEGINNERS (STEP BY STEP) 🐎,"['how to ride a horse', 'how to ride a horse for beginners', 'how to ride a horse for beginners english', 'how to ride a horse for beginners step by step', 'how to ride a horse step by step', 'step by step how to ride a horse', 'how to ride a horse english style', 'how to ride horses for beginners', 'how to ride a horse smoothly', 'how to ride a horse safely', 'how to ride horses', 'how to learn to ride a horse', 'horses', 'horse', 'horse riding', 'learn how to ride a horse']",2020-07-13T15:37:14Z,1904301,42900,2038,,PT9M30S,hd,https://i.ytimg.com/vi/fV7kuUrjutY/hqdefault.jpg
399,tGX1T4zh2uI,Animal Planet,Reindeer With Severe Antler 'Warts' Needs Help,"['dr dee alaska vet', 'reality tv series', 'frontier vet', 'veterinary practice', 'alaska pets', 'reindeer disease', 'antler warts', 'Animal Planet (TV Network)', 'dr. dee alaska vet tv show', 'dr. dee full episodes', 'Reindeer (Animal)']",2015-11-17T17:00:03Z,837011,5263,321,,PT3M44S,hd,https://i.ytimg.com/vi/tGX1T4zh2uI/hqdefault.jpg
400,nOVUUmWhWRk,Brave Wilderness,$100 Coffee vs. 1¢ Coffee - Which actually tastes better?,"['kopi luwak', 'coffee', 'civet', 'coyote peterson', 'brave wilderness', 'breaking trail', 'coffee taste test', 'P00P Coffee is REAL?! Tasting Most Expensive Coffee on Earth!', 'poop coffee', 'expensive coffee', 'tasting kopi luwak', 'tasting poop coffee', 'wildlife', 'wilderness', 'mark vins', 'kopi luwak coffee review', 'kopi luwak coffee', 'kopi luwak review', 'kopi luwak taste test', 'kopi luwak taste', 'poop coffee taste', 'poop coffee kopi luwak', 'civet cat', 'civet coffee', 'civet cat coffee', 'civet poop coffee', 'civets']",2021-03-20T13:00:10Z,460541,7988,869,,PT12M,hd,https://i.ytimg.com/vi/nOVUUmWhWRk/hqdefault.jpg
401,rwCPA4U8nvY,East Idaho News,What happens when someone is cremated?,,2021-09-10T18:08:38Z,3636351,28809,3682,,PT9M45S,hd,https://i.ytimg.com/vi/rwCPA4U8nvY/hqdefault.jpg
402,7m71otbaVsM,Aquarium Info,I Built Bikini Bottom in a Fish Tank,"['spongebob house', 'spongebob', 'spongebob squarepants', 'spongebob house in real life', 'house tour', 'bikini bottom', 'bikini bottom real life', 'spongebob theory', 'spongebob squarepants theory', 'bikini bottom theory', 'nuclear testing', 'patrick star', 'squidward', 'pineapple house', 'spongebob house tour in real life', 'real life', 'irl', 'patrick rock', 'mr krabs', 'sandy cheeks', 'squidward tentacles', 'aquarium info', 'aquarium info kirby', 'aquarium info axolotl', 'spongebob fish tank', 'spongebob aquarium']",2022-05-19T22:07:03Z,23445118,361605,6970,,PT8M4S,hd,https://i.ytimg.com/vi/7m71otbaVsM/hqdefault.jpg
403,SlLuC7257pc,BBC Earth,Alligators Showing Off for Mating Season | Animal Super Senses | BBC Earth,"['how do alligators mate', 'croc water dance', 'alligator mating call', 'alligators mating', 'alligator mating', 'crocodile mating call', 'crocodiles mating', 'how do crocodiles mate', 'crocodile mating', 'Animal Super Senses', 'Dance', 'Sonic', 'Hum', 'Bounce', 'Predator', 'Mate', 'Slow Motion', 'bbc', 'Mating', 'Alligator', 'Nature', 'Wild', 'Wildlife', 'Animals', 'Natural History', 'Slow Mo']",2015-12-04T14:38:31Z,1095567,8996,431,,PT4M15S,hd,https://i.ytimg.com/vi/SlLuC7257pc/hqdefault.jpg
404,GyahLck3i1U,Theo the Dachshund,HOW REACTS A MINI DACHSHUND WHEN HE IS HOME ALONE ?,"['dachshund', 'miniature dachshund', 'dog', 'cute dog', 'sausage dog', 'dachshund puppy', 'puppy', 'wiener dog', 'doxie', 'dachshund dog', 'cute dachshund', 'funny dog', 'funny dachshund', 'dachshund puppies', 'cute puppy', 'funny sausage dog', 'mini dachshund', 'mini dachshund puppies', 'mini dachshund puppy', 'chien saucisse', 'chien saucisse miniature', 'chien mignon', 'dog diary', 'a day in a life of a dachshund', 'how reats a mini dachshund when he is home alone']",2022-11-10T15:00:19Z,1273248,16072,999,,PT3M20S,hd,https://i.ytimg.com/vi/GyahLck3i1U/hqdefault.jpg
405,egukvmfsC0M,Живая Планета,Голые. Все как у зверей | Живая Планета,['Голые'],2016-10-21T08:00:01Z,97305,2075,115,,PT26M24S,hd,https://i.ytimg.com/vi/egukvmfsC0M/hqdefault.jpg
406,febBRv2Vftk,BBC Earth,The Tipping Point | Climate Change: The Facts | BBC Earth,"['bbc documentary', 'bbc', 'bbcearth', 'bbc earth', 'greta thunberg', 'greta thunberg how dare you', 'greta thunberg speech', 'climate change documentary', 'climate change explained', 'climate change speech', 'climate change news', 'climate change 2021']",2021-11-13T14:00:12Z,268099,5195,2571,,PT5M16S,hd,https://i.ytimg.com/vi/febBRv2Vftk/hqdefault.jpg
407,53aisZ7mhKY,Amare Gli Animali,Questo gatto è un vero uomo che lotta per il rispetto della propria ragazza,,2024-12-21T19:00:03Z,147994,8994,68,,PT1M1S,hd,https://i.ytimg.com/vi/53aisZ7mhKY/hqdefault.jpg
408,TE0lW6CQmAk,Тру Шорты,Песчаные пираньи,,2024-12-20T20:24:18Z,239957,11648,396,,PT1M29S,hd,https://i.ytimg.com/vi/TE0lW6CQmAk/hqdefault.jpg
409,q1MekJJxhts,CatInfo by Mirco,"Lebensmittel Vergleich mit Katze : Gurke, Ei, Eiswürfel! CatInfo #cat #catsoftiktok #catsofyoutube",,2023-03-30T14:19:55Z,1518122,65714,337,,PT39S,hd,https://i.ytimg.com/vi/q1MekJJxhts/hqdefault.jpg
410,l3L8EdMrnJA,InsecthausTV (Insecthaus),Hercules beetle lifecycle,"['Beetle', 'insect', 'nature', 'bug', 'amazing', 'rare', 'viral', 'Adrian Kozakiewicz', 'Insecthaus Adi', 'art', 'kunstwerk', 'kunst', 'artist', 'malen', 'färben', 'Zeichnung', 'unglaublich', 'wundervoll', 'beetle', 'stagbeetle', 'Käfer', 'bugs', 'insects', 'animals', 'tiere', 'wunderschön', 'einzigartig', 'Dorcus titanus', 'farben', 'colors', 'expensive', 'adrian kozakiewicz', 'insecthaus_adi', 'insecthaus', 'bug boy', 'germany', 'corona', 'usa', 'natur', 'künstler', 'hirschkäfer', 'dynastes hercules', 'herculeskäfer', 'hercules beetle']",2020-12-17T22:42:20Z,23200799,281336,13944,,PT2M27S,hd,https://i.ytimg.com/vi/l3L8EdMrnJA/hqdefault.jpg
411,gFyDOJUNJe8,River Monsters™,The Miracle Elephantiasis Treatment | HORROR STORY | River Monsters,"['river monsters', 'discovery channel', 'fishing', 'crocodile', 'anaconda', 'piranha', 'eel', 'dark waters', 'mighty rivers', 'alligator', 'catfish', 'tiger fish', 'shark', 'arapaima', 'amazon', 'brazil', 'jeremy wade', 'river monsters jeremy wade', 'catch', 'compilation', 'bite', 'blood', 'attack', 'river monsters piranha', 'animal planet', 'extreme fishing', 'river monsters chlidren', 'river monsters horror story', 'elephantisis']",2018-02-22T09:55:59Z,1928201,14441,658,,PT2M42S,hd,https://i.ytimg.com/vi/gFyDOJUNJe8/hqdefault.jpg
412,PP2stYeHxS0,Truestory,AI is really powerful.#americasgottalent  #magic #miracle  #agt #trend  #americagottalent,"['animal', 'story', 'truestory', 'hero', 'AI', 'ai']",2024-12-19T14:20:28Z,1977457,86097,148,,PT50S,hd,https://i.ytimg.com/vi/PP2stYeHxS0/hqdefault.jpg
